{
  "$schema": "./root-layout-classification.schema.json",
  "schemaVersion": 1,
  "baseline": {
    "total": 67,
    "files": 42,
    "directories": 25
  },
  "maximumEntries": 35,
  "targetMaxEntries": 35,
  "classifications": {
    "conventional": [
      ".dockerignore",
      ".github",
      ".gitignore",
      ".nvmrc",
      "package.json",
      "README.md"
    ],
    "generated": ["package-lock.json"],
    "project": [
      "config",
      "docker",
      "docker-compose.yml",
      "docs",
      "gateway",
      "install.sh",
      "llm-egress-proxy",
      "server",
      "shared",
      "src",
      "start.sh",
      "tasks",
      "tests",
      "uninstall.sh"
    ],
    "tooling": ["scripts"]
  }
}
